{
  "$schema": "./trust-model-v1.schema.json",
  "schemaVersion": 1,
  "modelVersion": "1.0.0-local.5",
  "status": "local-development-contract",
  "updatedAt": "2026-07-15",
  "protocol": {
    "path": "./protocol-v1.json",
    "version": "1.0.0-local.5",
    "consensusEngine": "CometBFT",
    "consensusVersion": "v0.39.3"
  },
  "sources": [
    {
      "name": "CometBFT consensus specification",
      "version": "v0.39.3",
      "commit": "49b82838fcca442b2445f76605c101609ed04130",
      "url": "https://github.com/cometbft/cometbft/blob/v0.39.3/spec/consensus/consensus.md"
    },
    {
      "name": "CometBFT evidence specification",
      "version": "v0.39.3",
      "commit": "49b82838fcca442b2445f76605c101609ed04130",
      "url": "https://github.com/cometbft/cometbft/blob/v0.39.3/spec/consensus/evidence.md"
    },
    {
      "name": "Cosmos SDK slashing module",
      "version": "v0.54.3",
      "commit": "046046a6731ddc00bca29193f5f0529d7017b3e3",
      "url": "https://github.com/cosmos/cosmos-sdk/blob/v0.54.3/x/slashing/README.md"
    },
    {
      "name": "Cosmos SDK evidence module",
      "version": "v0.54.3",
      "commit": "046046a6731ddc00bca29193f5f0529d7017b3e3",
      "url": "https://github.com/cosmos/cosmos-sdk/blob/v0.54.3/x/evidence/README.md"
    }
  ],
  "consensusAssumptions": {
    "quorumRule": "strictly-more-than-two-thirds-total-voting-power",
    "integerQuorumFormula": "floor(2*totalVotingPower/3)+1",
    "safetyAssumption": "byzantine-voting-power-strictly-less-than-one-third",
    "livenessAssumption": "strictly-more-than-two-thirds-timely-honest-and-mutually-reachable-voting-power",
    "networkModel": "partial-synchrony-with-eventual-message-delivery-and-increasing-round-timeouts",
    "validatorCountIsSecurityBoundary": false,
    "votingPowerIsSecurityBoundary": true,
    "oneThirdOrMoreCanHaltOrCensor": true,
    "oneThirdOrMoreMayViolateSafety": true,
    "evidenceIsBestEffortAfterAssumptionViolation": true
  },
  "livenessParameterOwners": [
    {
      "parameter": "consensus.timeout_propose",
      "ownerIssues": [93, 118, 119],
      "status": "unratified",
      "localValue": "1s",
      "localStatus": "active-local-unratified",
      "ratificationIssues": [118, 119],
      "rationale": "bounds the first proposal wait and must be load-tested against block propagation"
    },
    {
      "parameter": "consensus.timeout_propose_delta",
      "ownerIssues": [93, 118, 119],
      "status": "unratified",
      "localValue": "500ms",
      "localStatus": "active-local-unratified",
      "ratificationIssues": [118, 119],
      "rationale": "increases proposal time across rounds so eventual synchrony can restore progress"
    },
    {
      "parameter": "consensus.timeout_prevote",
      "ownerIssues": [93, 118, 119],
      "status": "unratified",
      "localValue": "500ms",
      "localStatus": "active-local-unratified",
      "ratificationIssues": [118, 119],
      "rationale": "bounds initial prevote collection without weakening the strict quorum rule"
    },
    {
      "parameter": "consensus.timeout_prevote_delta",
      "ownerIssues": [93, 118, 119],
      "status": "unratified",
      "localValue": "250ms",
      "localStatus": "active-local-unratified",
      "ratificationIssues": [118, 119],
      "rationale": "allows later rounds to tolerate measured network delay"
    },
    {
      "parameter": "consensus.timeout_precommit",
      "ownerIssues": [93, 118, 119],
      "status": "unratified",
      "localValue": "500ms",
      "localStatus": "active-local-unratified",
      "ratificationIssues": [118, 119],
      "rationale": "bounds initial precommit collection while preserving safe halt behavior"
    },
    {
      "parameter": "consensus.timeout_precommit_delta",
      "ownerIssues": [93, 118, 119],
      "status": "unratified",
      "localValue": "250ms",
      "localStatus": "active-local-unratified",
      "ratificationIssues": [118, 119],
      "rationale": "allows later rounds to recover after transient precommit delay"
    },
    {
      "parameter": "consensus.timeout_commit",
      "ownerIssues": [93, 118, 119],
      "status": "unratified",
      "localValue": "2s",
      "localStatus": "active-local-unratified",
      "ratificationIssues": [118, 119],
      "rationale": "controls the inter-block wait and must reconcile with the two-second target"
    }
  ],
  "stages": [
    {
      "id": "localnet-authority",
      "environment": "localnet",
      "activation": "active-local-only",
      "valueStatus": "valueless",
      "validatorCount": 4,
      "independentOperatorCount": 0,
      "administrativeTrustDomains": 1,
      "votingPower": [
        {
          "validator": "validator-0",
          "operator": "local-developer",
          "power": 25
        },
        {
          "validator": "validator-1",
          "operator": "local-developer",
          "power": 25
        },
        {
          "validator": "validator-2",
          "operator": "local-developer",
          "power": 25
        },
        {
          "validator": "validator-3",
          "operator": "local-developer",
          "power": 25
        }
      ],
      "totalVotingPower": 100,
      "commitQuorumPower": 67,
      "maximumGuaranteedUnavailablePower": 25,
      "keyCustody": "deterministic-local-fixtures-for-valueless-development-only",
      "decentralizationClaimAllowed": false,
      "controls": {
        "censor": {
          "actors": ["local developer controlling RPC and all validator keys"],
          "capability": "can reject ingress, omit transactions, or coordinate all proposers and voters"
        },
        "halt": {
          "actors": ["local developer", "any unavailable two-validator set"],
          "capability": "can stop more than one-third of voting power and halt commits"
        },
        "upgrade": {
          "actors": ["local developer"],
          "capability": "can replace all binaries or reset the valueless environment"
        },
        "rewrite": {
          "actors": [
            "local developer controlling all keys, state, and endpoint metadata"
          ],
          "capability": "can replace local history or genesis presented to clients; this is an administrative reset, not a valid same-genesis reorganization"
        }
      }
    },
    {
      "id": "private-devnet-authority",
      "environment": "devnet",
      "activation": "reserved-private-inactive",
      "valueStatus": "valueless-if-activated",
      "validatorCount": 4,
      "independentOperatorCount": 0,
      "administrativeTrustDomains": 1,
      "votingPower": [
        {
          "validator": "authority-0",
          "operator": "torium-authority",
          "power": 25
        },
        {
          "validator": "authority-1",
          "operator": "torium-authority",
          "power": 25
        },
        {
          "validator": "authority-2",
          "operator": "torium-authority",
          "power": 25
        },
        {
          "validator": "authority-3",
          "operator": "torium-authority",
          "power": 25
        }
      ],
      "totalVotingPower": 100,
      "commitQuorumPower": 67,
      "maximumGuaranteedUnavailablePower": 25,
      "keyCustody": "separate-host-keys-required-before-activation-but-one-organizational-authority",
      "decentralizationClaimAllowed": false,
      "controls": {
        "censor": {
          "actors": [
            "Torium authority controlling RPC and all validator operators"
          ],
          "capability": "can censor ingress or coordinate one-third-or-more voting power"
        },
        "halt": {
          "actors": ["Torium authority", "shared infrastructure failure"],
          "capability": "can make one-third-or-more voting power unavailable"
        },
        "upgrade": {
          "actors": [
            "Torium release authority plus cooperating validator operator"
          ],
          "capability": "can coordinate binary upgrades; on-chain authority remains blocked on issue 106"
        },
        "rewrite": {
          "actors": [
            "authority controlling keys, snapshots, and trusted endpoint metadata"
          ],
          "capability": "can present an unsafe restore or replacement genesis to dependent clients; clients must pin genesis and trusted hashes"
        }
      }
    },
    {
      "id": "public-testnet-independent-readiness",
      "environment": "testnet",
      "activation": "reserved-public-inactive",
      "valueStatus": "valueless-only",
      "validatorCount": 7,
      "independentOperatorCount": 7,
      "administrativeTrustDomains": 7,
      "votingPower": [
        { "validator": "operator-0", "operator": "independent-0", "power": 15 },
        { "validator": "operator-1", "operator": "independent-1", "power": 15 },
        { "validator": "operator-2", "operator": "independent-2", "power": 14 },
        { "validator": "operator-3", "operator": "independent-3", "power": 14 },
        { "validator": "operator-4", "operator": "independent-4", "power": 14 },
        { "validator": "operator-5", "operator": "independent-5", "power": 14 },
        { "validator": "operator-6", "operator": "independent-6", "power": 14 }
      ],
      "totalVotingPower": 100,
      "commitQuorumPower": 67,
      "maximumGuaranteedUnavailablePower": 30,
      "keyCustody": "one-consensus-key-per-independent-operator-with-no-shared-signing-authority",
      "decentralizationClaimAllowed": false,
      "readinessOnly": true,
      "readinessGates": {
        "minimumActiveValidators": 7,
        "minimumIndependentOperators": 7,
        "minimumInfrastructureDomains": 4,
        "minimumRegions": 4,
        "maximumSingleOperatorPower": 15,
        "maximumSharedFailureDomainPower": 30,
        "tolerateAnyTwoValidatorOutages": true,
        "requiredOwnerIssues": [100, 106, 117, 119, 123, 124, 126]
      },
      "controls": {
        "censor": {
          "actors": [